{
  "schemaVersion": "mission-control/eval-receipt/v1",
  "runId": "mission-control-golden:ef3147464d23:1788732440846",
  "idempotencyKey": "ef3147464d2334e68beab91f3b466d08003af8f5:sha256:c353aacb14e74fd8b3253bd1e85b6006542fe1a899280c7445936f24837a9344:sha256:d14e3ccd0db344a6bf6397c71380f1511f429ccbf03faecd37dcc3d0fbaf9090",
  "suite": {
    "key": "mission-control-golden-path",
    "version": 1,
    "digest": "sha256:d14e3ccd0db344a6bf6397c71380f1511f429ccbf03faecd37dcc3d0fbaf9090"
  },
  "baseline": {
    "baselineId": "mission-control-golden-v1-main",
    "digest": "sha256:3538953f4840c4b25eb80855cc89a18ce489fc4bf3ab694c631441c3e1ae38fa"
  },
  "runStatus": "COMPLETED",
  "verdict": "WARN",
  "publishable": true,
  "releaseBlocking": false,
  "acceptanceAuthority": false,
  "provenance": {
    "repository": "jaydubya818/MissionControl",
    "revision": "ef3147464d2334e68beab91f3b466d08003af8f5",
    "baseRevision": "e0b15142a33987983526b87c2144208e40e98657",
    "adapter": {
      "id": "system-factory-scenario-evidence",
      "version": "1.0.0",
      "digest": "sha256:461d40745f8a80277c04004c506a3e5565ea766adc70e73aebfc7f4d69234bd9"
    },
    "runtime": {
      "name": "node",
      "version": "24.18.1"
    },
    "datasetDigest": "sha256:d14e3ccd0db344a6bf6397c71380f1511f429ccbf03faecd37dcc3d0fbaf9090",
    "resolvedConfigDigest": "sha256:0b0b520e5e5d0967a1d1e3b20f467066bbfaa79a6b95d892b1407ef2850470d3",
    "seed": "mission-control-golden-v1",
    "artifacts": [
      {
        "path": "docs/testing/evidence/fdlc-bedrock-live-system-v52-20260906/scenario-evidence.json",
        "digest": "sha256:c353aacb14e74fd8b3253bd1e85b6006542fe1a899280c7445936f24837a9344"
      }
    ]
  },
  "metrics": {
    "totalCases": 7,
    "scoredCases": 7,
    "passedCases": 6,
    "failedCases": 1,
    "invalidCases": 0,
    "skippedCases": 0,
    "blockingCases": 6,
    "blockingPassed": 6,
    "advisoryCases": 1,
    "advisoryPassed": 0,
    "completionRate": 1,
    "blockingPassRate": 1,
    "advisoryPassRate": 0,
    "invalidRatio": 0,
    "totalDurationMs": 9304,
    "totalCostUsd": 0,
    "slices": [
      {
        "slice": "authority",
        "cases": 2,
        "passed": 2,
        "failed": 0,
        "invalid": 0,
        "skipped": 0,
        "passRate": 1
      },
      {
        "slice": "economics",
        "cases": 1,
        "passed": 0,
        "failed": 1,
        "invalid": 0,
        "skipped": 0,
        "passRate": 0
      },
      {
        "slice": "evidence",
        "cases": 1,
        "passed": 1,
        "failed": 0,
        "invalid": 0,
        "skipped": 0,
        "passRate": 1
      },
      {
        "slice": "harness",
        "cases": 1,
        "passed": 1,
        "failed": 0,
        "invalid": 0,
        "skipped": 0,
        "passRate": 1
      },
      {
        "slice": "intent",
        "cases": 1,
        "passed": 1,
        "failed": 0,
        "invalid": 0,
        "skipped": 0,
        "passRate": 1
      },
      {
        "slice": "learning",
        "cases": 1,
        "passed": 1,
        "failed": 0,
        "invalid": 0,
        "skipped": 0,
        "passRate": 1
      },
      {
        "slice": "lineage",
        "cases": 1,
        "passed": 1,
        "failed": 0,
        "invalid": 0,
        "skipped": 0,
        "passRate": 1
      },
      {
        "slice": "observability",
        "cases": 1,
        "passed": 0,
        "failed": 1,
        "invalid": 0,
        "skipped": 0,
        "passRate": 0
      },
      {
        "slice": "provenance",
        "cases": 1,
        "passed": 1,
        "failed": 0,
        "invalid": 0,
        "skipped": 0,
        "passRate": 1
      },
      {
        "slice": "recovery",
        "cases": 1,
        "passed": 1,
        "failed": 0,
        "invalid": 0,
        "skipped": 0,
        "passRate": 1
      },
      {
        "slice": "resilience",
        "cases": 1,
        "passed": 1,
        "failed": 0,
        "invalid": 0,
        "skipped": 0,
        "passRate": 1
      },
      {
        "slice": "safety",
        "cases": 2,
        "passed": 2,
        "failed": 0,
        "invalid": 0,
        "skipped": 0,
        "passRate": 1
      },
      {
        "slice": "verification",
        "cases": 1,
        "passed": 1,
        "failed": 0,
        "invalid": 0,
        "skipped": 0,
        "passRate": 1
      }
    ]
  },
  "results": [
    {
      "caseKey": "exact-intent-lineage",
      "caseName": "Exact intent remains bound",
      "severity": "BLOCKING",
      "slices": [
        "intent",
        "lineage"
      ],
      "evidenceRefs": [
        "docs/testing/evidence/fdlc-bedrock-live-system-v52-20260906/scenario-evidence.json"
      ],
      "verdict": "PASS",
      "score": 1,
      "assertionResults": [
        {
          "code": "finalized-spec-present",
          "path": "lineage.finalizedSpecRevisionId",
          "operator": "PRESENT",
          "passed": true,
          "observed": "mission-spec-system-factory-e2e-v2-r2",
          "expected": "present"
        },
        {
          "code": "bound-spec-is-finalized",
          "path": "lineage.boundSpecRemainedRevision",
          "operator": "EQUALS_PATH",
          "passed": true,
          "observed": "mission-spec-system-factory-e2e-v2-r2",
          "expected": "mission-spec-system-factory-e2e-v2-r2"
        },
        {
          "code": "newer-spec-did-not-rebind",
          "path": "lineage.currentSpecRevisionId",
          "operator": "NOT_EQUALS_PATH",
          "passed": true,
          "observed": "mission-spec-system-factory-e2e-v2-r3",
          "expected": "mission-spec-system-factory-e2e-v2-r2"
        },
        {
          "code": "spec-digest-pinned",
          "path": "lineage.finalizedSpecDigest",
          "operator": "SHA256",
          "passed": true,
          "observed": "sha256:3187eba71569bb50e9893bd14eeb59d80929476bae7b10d56ca5af78e348b3dc",
          "expected": "sha256:<64 lowercase hex>"
        },
        {
          "code": "quality-contract-pinned",
          "path": "lineage.qualityContractDigest",
          "operator": "SHA256",
          "passed": true,
          "observed": "sha256:742129e4ddf06390df7c7d3967a33027097d582dd112e80713cc7cce9a85f365",
          "expected": "sha256:<64 lowercase hex>"
        },
        {
          "code": "separate-plan-approval",
          "path": "lineage.planApproval.approvedBy",
          "operator": "NOT_EQUALS_PATH",
          "passed": true,
          "observed": "operator-approver",
          "expected": "operator-author"
        },
        {
          "code": "work-order-revision-present",
          "path": "lineage.workOrderRevision",
          "operator": "NUMBER_GTE",
          "passed": true,
          "observed": 1,
          "expected": ">= 1"
        }
      ],
      "failedAssertionCodes": [],
      "outputDigest": "sha256:560aef2a744ecb8488cc12497f3715d0dd26081dfcfba982eb60a08cc25f2a8b"
    },
    {
      "caseKey": "bounded-human-authority",
      "caseName": "Acceptance authority stays human",
      "severity": "BLOCKING",
      "slices": [
        "authority",
        "safety"
      ],
      "evidenceRefs": [
        "docs/testing/evidence/fdlc-bedrock-live-system-v52-20260906/scenario-evidence.json"
      ],
      "verdict": "PASS",
      "score": 1,
      "assertionResults": [
        {
          "code": "human-acceptance-actor",
          "path": "lineage.acceptanceActor",
          "operator": "EQUALS",
          "passed": true,
          "observed": "human operator",
          "expected": "human operator"
        },
        {
          "code": "workorders-only-writer",
          "path": "authority.workOrderAcceptedEventWriters",
          "operator": "ARRAY_LENGTH_EQUALS",
          "passed": true,
          "observed": [
            "workOrders.ts"
          ],
          "expected": "array length = 1"
        },
        {
          "code": "workorders-writer-present",
          "path": "authority.workOrderAcceptedEventWriters",
          "operator": "ARRAY_INCLUDES",
          "passed": true,
          "observed": [
            "workOrders.ts"
          ],
          "expected": "workOrders.ts"
        },
        {
          "code": "learning-no-acceptance",
          "path": "authority.learningHasAcceptanceMutation",
          "operator": "EQUALS",
          "passed": true,
          "observed": false,
          "expected": false
        },
        {
          "code": "observability-no-acceptance",
          "path": "authority.observabilityHasAcceptanceMutation",
          "operator": "EQUALS",
          "passed": true,
          "observed": false,
          "expected": false
        },
        {
          "code": "plan-self-approval-blocked",
          "path": "authority.planSelfApprovalGuard",
          "operator": "EQUALS",
          "passed": true,
          "observed": true,
          "expected": true
        },
        {
          "code": "sandbox-no-github-authority",
          "path": "authority.sandboxHasGithubAuthority",
          "operator": "EQUALS",
          "passed": true,
          "observed": false,
          "expected": false
        }
      ],
      "failedAssertionCodes": [],
      "outputDigest": "sha256:560aef2a744ecb8488cc12497f3715d0dd26081dfcfba982eb60a08cc25f2a8b"
    },
    {
      "caseKey": "exact-current-evidence",
      "caseName": "Evidence matches the exact candidate",
      "severity": "BLOCKING",
      "slices": [
        "evidence",
        "verification"
      ],
      "evidenceRefs": [
        "docs/testing/evidence/fdlc-bedrock-live-system-v52-20260906/scenario-evidence.json"
      ],
      "verdict": "PASS",
      "score": 1,
      "assertionResults": [
        {
          "code": "quality-gate-eligible",
          "path": "lineage.qualityGateState",
          "operator": "EQUALS",
          "passed": true,
          "observed": "ELIGIBLE",
          "expected": "ELIGIBLE"
        },
        {